{
  "id": "vr/document.json.valid",
  "version": "0.1.0",
  "tier": "HARD",
  "domain": "document",
  "task_type": "file_validation",
  "description": "Verifies that a file contains valid JSON with optional type and key checks.",
  "ground_truth_schema": {
    "type": "object",
    "required": ["file_path"],
    "properties": {
      "file_path": { "type": "string" },
      "expected_keys": { "type": ["array", "null"], "items": { "type": "string" } },
      "expected_type": { "type": ["string", "null"], "enum": ["object", "array", null] }
    }
  },
  "scorecard": {
    "determinism": "deterministic",
    "evidence_quality": "hard-state",
    "intended_use": "eval-and-train",
    "gating_required": false,
    "recommended_gates": [],
    "permissions_required": ["fs:read"],
    "source_benchmark": "custom",
    "source_citation": "",
    "expected_latency_ms": 10,
    "cost_tier": "free",
    "recommended_composition": ["filesystem.file_created"]
  },
  "contributor": "vr.dev",
  "created_at": "2026-03-15",
  "source_citation": "",
  "permissions_required": ["fs:read"]
}
