{
  "id": "vr/code.python.lint_ruff",
  "version": "0.1.0",
  "tier": "HARD",
  "domain": "code",
  "task_type": "lint_verification",
  "description": "Verifies that agent-generated Python code passes ruff lint checks with configurable violation thresholds.",
  "ground_truth_schema": {
    "type": "object",
    "properties": {
      "max_violations": {
        "type": "integer",
        "default": 0
      }
    }
  },
  "scorecard": {
    "determinism": "deterministic",
    "evidence_quality": "hard-state",
    "intended_use": "eval-and-train",
    "gating_required": false,
    "recommended_gates": [],
    "permissions_required": [
      "fs:write_tmp",
      "exec:ruff"
    ],
    "source_benchmark": "Zeno-bench",
    "source_citation": "code-quality"
  },
  "contributor": "vr.dev",
  "created_at": "2026-03-04",
  "source_citation": "code-quality",
  "permissions_required": [
    "fs:write_tmp",
    "exec:ruff"
  ]
}
