{
  "id": "vr/rubric.summary.faithful",
  "version": "0.1.0",
  "tier": "SOFT",
  "domain": "nlp",
  "task_type": "summary_faithfulness",
  "description": "Scores summary faithfulness to source text via a 3-component LLM rubric: factual accuracy, key points coverage, no hallucinations.",
  "source_benchmark": null,
  "source_citation": "tobysimonds.com/research/2025/09/29/Proofs.html",
  "ground_truth_schema": {
    "type": "object",
    "required": ["source_text", "key_points"],
    "properties": {
      "source_text": { "type": "string" },
      "key_points": { "type": "array", "items": { "type": "string" } }
    }
  },
  "scorecard": {
    "determinism": "stochastic-judge",
    "evidence_quality": "judge-opinion",
    "attack_surface": {
      "injection_risk": "medium",
      "format_gaming_risk": "medium",
      "tool_spoofing_risk": "low"
    },
    "intended_use": "eval-and-train",
    "gating_required": false,
    "recommended_gates": [],
    "permissions_required": ["net:llm"],
    "source_citation": "tobysimonds.com/research/2025/09/29/Proofs.html"
  },
  "permissions_required": ["net:llm"],
  "contributor": "vr.dev",
  "created_at": "2026-03-04"
}
