{
  "id": "vr/tau2.retail.order_cancelled",
  "version": "0.1.0",
  "tier": "HARD",
  "domain": "retail",
  "task_type": "order_management",
  "description": "Queries retail API to confirm an order is in cancelled state with matching reason code.",
  "ground_truth_schema": {
    "type": "object",
    "required": [
      "order_id"
    ],
    "properties": {
      "order_id": {
        "type": "string"
      },
      "expected_status": {
        "type": "string",
        "default": "cancelled"
      },
      "expected_reason": {
        "type": [
          "string",
          "null"
        ]
      }
    }
  },
  "scorecard": {
    "determinism": "deterministic",
    "evidence_quality": "api-state",
    "intended_use": "eval-and-train",
    "gating_required": false,
    "recommended_gates": [],
    "permissions_required": [
      "net:http"
    ],
    "source_benchmark": "\u03c4\u00b2-bench",
    "source_citation": "arXiv:2406.12045"
  },
  "contributor": "vr.dev",
  "created_at": "2026-03-04",
  "source_citation": "arXiv:2406.12045",
  "permissions_required": [
    "net:http"
  ]
}
